<!ELEMENT query-service (query-service-config*)>

<!ELEMENT query-service-config (config-alias,repository-class, backup-filename?, pre-load?, listener-class?, memory-auto-commit?, query-param*, description?)>
<!ELEMENT config-alias (#PCDATA)>
<!ELEMENT repository-class (#PCDATA)> <!-- jspeed.base.repository.Repository interface -->
<!ELEMENT backup-filename (#PCDATA)>
<!ELEMENT pre-load (#PCDATA)> <!-- true | false, default=false -->
<!ELEMENT listener-class (#PCDATA)> <!-- jspeed.base.repository.RepositoryListener interface -->
<!ELEMENT memory-auto-commit (#PCDATA)> <!-- true | false, default=true -->
<!ELEMENT query-param (param-name, param-value)>

<!ELEMENT param-name (#PCDATA)>
<!ELEMENT param-value (#PCDATA)>
<!ELEMENT description (#PCDATA)>

<!ATTLIST query-service
	defaultElement CDATA #IMPLIED
	verbose (true | false) 'false'>
	
<!ATTLIST query-service-config
	name CDATA #REQUIRED
	deploy (true | false) 'false'
	loadOnStartup CDATA #IMPLIED
	verbose (true | false) 'false'
	lastModified CDATA #IMPLIED
	target CDATA #IMPLIED>

<!ATTLIST backup-filename
	isBackup (true | false) 'false'>	
	
		
